{
  "scenario": "dashboard-invalid-param",
  "status": "pass",
  "verdict_source": "deterministic_checker",
  "agent_summary": "Codex attempted to change system.secret through the dashboard UI, observed the validation error, and recorded deterministic helper evidence that params remained unchanged.",
  "commands": [
    {
      "command": "tools/testing/agent_smoke_evidence.py baseline --base-url http://127.0.0.1:8000 --out test-results/agent-smoke/latest/api-baseline.json",
      "exit_code": 0
    },
    {
      "command": "tools/testing/agent_smoke_evidence.py collect --scenario dashboard-invalid-param --base-url http://127.0.0.1:8000 --baseline test-results/agent-smoke/latest/api-baseline.json --operation-log test-results/agent-smoke/latest/operation-log.jsonl --out test-results/agent-smoke/latest/api-summary.json",
      "exit_code": 0
    },
    {
      "command": "make validate-agent-smoke-result RESULT_DIR=test-results/agent-smoke/latest",
      "exit_code": 0
    }
  ],
  "artifacts": {
    "transcript": "transcript.md",
    "console_log": "console.log",
    "api_summary": "api-summary.json",
    "operation_log": "operation-log.jsonl",
    "screenshots": [
      "screenshots/dashboard-invalid-param.png"
    ]
  },
  "assertions": [
    {
      "name": "reserved system param is rejected and params remain unchanged",
      "status": "pass",
      "evidence": {
        "source": "api-summary.json",
        "invalid_path": "system.secret",
        "params_unchanged": true,
        "ui_error_seen": true,
        "health_status": "ok"
      }
    }
  ],
  "failures": []
}
