{
  "scenario": "dashboard-agent-autotune",
  "status": "pass",
  "verdict_source": "deterministic_checker",
  "agent_summary": "Codex set counter.increment through the dashboard UI, triggered Auto-Tune through the UI, observed success and patch evidence, and recorded deterministic checker evidence.",
  "commands": [
    {
      "command": "tools/testing/agent_smoke_evidence.py baseline --base-url http://127.0.0.1:8000 --out test-results/agent-smoke/latest/api-baseline.json",
      "exit_code": 0
    },
    {
      "command": "tools/testing/agent_smoke_evidence.py collect --scenario dashboard-agent-autotune --base-url http://127.0.0.1:8000 --baseline test-results/agent-smoke/latest/api-baseline.json --operation-log test-results/agent-smoke/latest/operation-log.jsonl --out test-results/agent-smoke/latest/api-summary.json",
      "exit_code": 0
    },
    {
      "command": "make validate-agent-smoke-result RESULT_DIR=test-results/agent-smoke/latest",
      "exit_code": 0
    }
  ],
  "artifacts": {
    "transcript": "transcript.md",
    "console_log": "console.log",
    "api_summary": "api-summary.json",
    "operation_log": "operation-log.jsonl",
    "screenshots": [
      "screenshots/dashboard-agent-autotune.svg"
    ]
  },
  "assertions": [
    {
      "name": "dashboard Auto-Tune applies a deterministic params-agent patch through UI",
      "status": "pass",
      "evidence": {
        "source": "api-summary.json",
        "baseline_counter_increment": 2,
        "observed_counter_increment": 1,
        "patch_paths": [
          "counter.increment"
        ],
        "params_applied_event_source": "agent.params",
        "ui_success_seen": true,
        "ui_patches_seen": true
      }
    }
  ],
  "failures": []
}
